Date,ID,Full Text,Retweet Count,Like Count,HashTags
2019-04-12 18:07:00,1116764668997947392,"PM Shri @narendramodi will address three mega rallies in Tamil Nadi and Karnataka on 13 April 2019. Watch at 

∙ https://t.co/vpP0MI6iTu 
∙ https://t.co/KrGm5hWgwn 
∙ https://t.co/EyN23goWO7 
∙ NaMoTV

Dial 9345014501 to listen LIVE. @BJP4TamilNadu @BJP4Karnataka https://t.co/WO1J3I95Sr",94,298,[]
2019-04-12 18:05:00,1116764166696722433,"भाजपा राष्ट्रीय अध्यक्ष श्री @AmitShah जी की 13 अप्रैल 2019 को उत्तर प्रदेश के बदायूं और शाहजहांपुर में विशाल जनसभाएं। 

लाइव देखें : 

∙ https://t.co/vpP0MInUi4 
∙ https://t.co/KrGm5idRUX 
∙ https://t.co/EyN23g7lWz 
∙ NaMoTV https://t.co/0EOUFUm9jf",59,273,[]
2019-04-12 17:50:00,1116760391571390466,"Smt @SushmaSwaraj will interact with Indians living across the globe on 13th April 2019 at 20.30 IST.

Tune in to digital platforms of @BJP4India and NaMo TV to watch LIVE. https://t.co/4evcFttvaj",104,364,[]
2019-04-12 17:35:36,1116756767071981568,"“The foreign intruders unsuccessfully assaulted our cultural traditions and ethos during their hundreds of years of suppression.

The same mindset has attempted to attack our faith in Sabarimala case. We shall present the case comprehensively in the SC.”: PM #ModiHiAayega https://t.co/0dc9zpwEOo",348,1028,['ModiHiAayega']
2019-04-12 16:55:45,1116746738969337857,"The so-called defenders of women rights are the ones at the forefront of defending the barbaric practice of Triple Talaq.

These so-called Liberals activate their entire network of urban Naxals, Tukde-Tukde Gang to interfere in the faith &amp; traditions of our land: PM #ModiHiAayega https://t.co/v4sJDQ5xKs",342,1073,['ModiHiAayega']
2019-04-12 16:43:39,1116743692956635138,"RT @narendramodi: Congress and JD(S) would not like the sights from Gangavathi…it is BJP all the way!

Before every election either Deve Go…",3028,0,[]
2019-04-12 14:44:05,1116713604516986880,"माँ भारती के लिए खून बहाने वाली पराक्रमी गोरखा जाति को NRC से डरने की कोई ज़रूरत नहीं है। उनके अलावा आस पास के देशों से आए सभी हिंदू, सिख, बौद्ध, जैन और क्रिश्चन शरणार्थियों को भी भारतीय नागरिकता देने का काम भाजपा सरकार करेगी: श्री अमित शाह #ModiHiAayega https://t.co/qKJJoX6uqS",615,1985,['ModiHiAayega']
2019-04-12 14:32:32,1116710697965015046,"Our opposition leaders are now heroes in Pakistan, where their speeches are quoted, their statements used freely by the leadership there to discredit India: PM Modi #ModiHiAayega https://t.co/ZwzHg1tdbj",278,787,['ModiHiAayega']
2019-04-12 14:27:15,1116709367833714688,"भारतीय जनता पार्टी का पूरा प्रयास होगा कि सुप्रीम कोर्ट के सामने केरल की सैकड़ों वर्ष पुरानी आस्था, परंपरा और पूजा पद्धति का विषय विस्तार से रखा जाए। 

हमारी सरकार ये भी कोशिश करेगी कि आस्था और विश्वास के विषयों को संवैधानिक संरक्षण मिले: पीएम मोदी #ModiHiAayega",277,945,['ModiHiAayega']
2019-04-12 14:26:22,1116709144809984007,"अब सुप्रीम कोर्ट के आदेश की आड़ में कुछ ताकतों ने फिर अपना स्वार्थ साधने की कोशिश की है।

हमारी परंपराओं पर ये हमला, स्वीकार नहीं होगा। 

निर्दोष भक्तों पर लाठियां, अब स्वीकार नहीं होंगी: पीएम मोदी #ModiHiAayega https://t.co/KbzSPWb8sp",221,676,['ModiHiAayega']
2019-04-12 14:25:10,1116708845127028736,"भारत की हजारों वर्ष की सांस्कृतिक परंपरा है, इन परंपराओं पर लोगों का विश्वास है। 

सैकड़ों वर्षों की गुलामी के दौरान विदेशी ताकतों ने बार-बार इन परंपराओं को तार-तार करने का प्रयास किया, लेकिन सफल नहीं हो पाईं: पीएम मोदी #ModiHiAayega",208,747,['ModiHiAayega']
2019-04-12 14:19:15,1116707356778254336,"I assure my fellow BJP Karyakartas- your struggles will not go in vain.  

Their bullying will not weaken us: PM Modi #ModiHiAayega https://t.co/cM8SsKyhLf",329,1102,['ModiHiAayega']
2019-04-12 14:18:17,1116707112279654402,"Kerala is a land of peace &amp; harmony but insensitive Communists &amp; Congress have brought a culture of political violence

Several patriotic RSS &amp; BJP Karyakartas have been attacked and killed for serving the people: PM Modi #ModiHiAayega https://t.co/GxCdo9KYDZ",205,536,['ModiHiAayega']
2019-04-12 14:15:30,1116706411386269697,"Right now, the entire nation is talking about Tughlak Road Election Scam.

In Madhya Pradesh, crores of rupees, bags of cash have been found.   

Detailed probes revealed that the money trail reaches the house of a top Congress leader in Delhi’s Tughlak Road: PM #ModiHiAayega",331,897,['ModiHiAayega']
2019-04-12 14:13:37,1116705937224425472,"Electing the Congress and Communists is like giving a license to their leaders to engage in top-level corruption: PM Modi 

Dial 9345014501 to listen LIVE. #ModiHiAayega",241,811,['ModiHiAayega']
2019-04-12 14:10:41,1116705200570425344,UDF and LDF are different only in name. In deeds they are the same. Both have taken turns to loot the state: PM Modi #ModiHiAayega,221,750,['ModiHiAayega']
2019-04-12 14:05:17,1116703841368416256,"For decades, LDF and UDF have dominated the politics of Kerala but they have miserably failed people of Kerala. 

BJP presents an alternative that is inclusive, democratic and compassionate: PM Modi #ModiHiAayega https://t.co/63NW1RnRY1",212,601,['ModiHiAayega']
2019-04-12 14:00:41,1116702683396599810,"PM Modi addresses public meeting in Calicut, Kerala. Dial 9345014501 to listen LIVE. #ModiHiAayega https://t.co/7yoNhB5sQV",450,1436,['ModiHiAayega']
2019-04-12 13:52:56,1116700733884125188,"यहां की कांग्रेस सरकार ने आते ही सीबीआई पर प्रतिबंध लगा दिया, ताकि ये बिना डर के ये लूट-खसोट कर पाएं।

देशभर में सीमेंट के दाम घट रहे हैं, लेकिन छत्तीसगढ़ में सीमेंट के दाम बढ़ रहे हैं क्योंकि अब भूपेश बघेल टैक्स इस पर लग गया है: श्री अमित शाह #ModiHiAayega https://t.co/IeLRXv92ve",409,1165,['ModiHiAayega']
2019-04-12 13:49:06,1116699767499673600,"देश में 10 साल तक सोनिया-मनमोहन की सरकार थी, इन्होंने 12 लाख करोड़ रुपये के घपले-घोटाले किए। 

55 साल तक उनकी 4 पीढ़ियों ने देश पर शासन किया, तब विकास नहीं कर पाए।  

मोदी जी ने 5 साल देश पर शासन किया और गरीबों के समग्र विकास के लिए अनगिनत कार्य किए: श्री अमित शाह #ModiHiAayega https://t.co/VPmxxsTH9V",330,962,['ModiHiAayega']
2019-04-12 13:33:37,1116695871951781888,"कर्नाटक के मुख्यमंत्री ने कहा है कि सेना में वही लोग जाते हैं जिन्हें दो वक्त का खाना नहीं मिलता।

ये कैसी सोच है कुमारस्वामी जी?

आप ये कहकर नहीं बच सकते कि आपके बयान का गलत मतलब निकाला गया।

आपने वही कहा है, जो आपके दिल में है।

ये हमारे सुरक्षाबलों का अपमान है या नहीं?: पीएम https://t.co/iVUtodpUwe",1463,4261,[]
2019-04-12 13:32:08,1116695495617826816,"देवगौड़ा जी के बेटे ने कहा है कि केंद्र में फिर मोदी सरकार बन गई तो वो राजनीति से संन्यास ले लेंगे।

2014 के चुनाव के पहले खुद देवगौड़ा जी ने भी तो यही कहा था। 

लेकिन मेरे पीएम बनने के बाद उन्होंने संन्यास लिया क्या?: प्रधानमंत्री श्री @narendramodi #ModiHiAayega https://t.co/t21ztBDOmK",463,1267,['ModiHiAayega']
2019-04-12 13:19:04,1116692207572963329,"We don't just promise, we deliver. 

Promise: Will engage with foreign govts to facilitate information sharing on black money.

Delivery: Agreement on sharing real-time information with Switzerland and information sharing agreement with USA has been done. #ModiHiAayega https://t.co/fUdJQV5DoT",231,611,['ModiHiAayega']
2019-04-12 13:07:03,1116689183278452737,"Memorandum submitted by BJP delegation to ECI against Congress President, Rahul Gandhi for repeated violation of the Representation of People Act, 1951 &amp; Model Code of Conduct through unverified, false &amp; frivolous statements made against PM. https://t.co/1VaaudssD7 https://t.co/FEDjPX8Ut6",385,896,[]
2019-04-12 12:26:48,1116679055636492288,"For the development of Odisha, Modi govt has carried out several infrastructural and connectivity work.

The govt has built IIM, IIT and ESIC hospital. Besides, Rs. 10,000 crore has been spent on four lane road: Shri @AmitShah #ModiHiAayega https://t.co/8camaOzeIL",238,730,['ModiHiAayega']
2019-04-12 12:25:09,1116678641306329094,"Karnataka govt is dilly-dallying on sending the list of farmers to us &amp; thus depriving farmers of their money.

Once we form govt again, all farmers will receive financial assistance under PM Kisan scheme. Besides, all farmers over 60 years will be entitled to pension: PM Modi https://t.co/op7PjN2nfN",285,765,[]
2019-04-12 12:22:56,1116678084218904576,"Congress and JDS are against the nationalists. They stand with people who are anti-India and raise 'Break India' slogans.

They have money for the festival of sultan, but they fall short of money for the Hampi festival: PM @narendramodi #ModiHiAayega https://t.co/jRzG3LrIqf",594,1555,['ModiHiAayega']
2019-04-12 12:19:42,1116677269970231296,"In Tughlak road election scam, crores of money have been sent from MP to Delhi for election.

The seized money was meant for nutritious food for the poor children &amp; pregnant women. 

Congress didn't even spare the food for innocent children: PM @narendramodi #ModiHiAayega https://t.co/NwLO0c3Efl",435,971,['ModiHiAayega']
2019-04-12 12:16:47,1116676535883165696,"2019 is an election between the nationalism and dynasty.

Both the parties, Congress and JDS, are detached from people and attached to their own family. 

Their family is their only priority and their only mission is Commission: PM @narendramodi #ModiHiAayega https://t.co/ngkM2TZ8oV",379,1038,['ModiHiAayega']
2019-04-12 12:13:13,1116675637089947649,"On one hand, Modi govt builds hospitals with the money from mining and on the other hand, a Commission has found corruption in issuing of mining lease.

The land of Odisha is rich in natural resources but the corruption has kept them poor: Shri @AmitShah #ModiHiAayega https://t.co/W4XZNPTiga",348,896,['ModiHiAayega']
2019-04-12 12:11:44,1116675266351255552,"Navin Babu is the CM of Odisha for the last 19 years but the state still lacks in education and employment opportunities.

The youth of people have to go to other states in search of livelihood.

If we form govt, we'd ensure ample opportunities for people: Shri @AmitShah https://t.co/PIszoEhk5P",233,604,[]
2019-04-12 12:10:10,1116674870216019968,"Under District Mineral Fund, Rs. 1,600 crore has been allocated to this district.

The hospital in sight is being built from the money sent by the Centre. It'll provide healthcare services. 

But Navin Babu hasn't spent a single penny on the hospital: Shri @AmitShah #ModiHiAayega https://t.co/Jafh7FvOhg",379,1271,['ModiHiAayega']
2019-04-12 11:42:56,1116668014529634305,"We don't just promise, we deliver. 

Promise: Will eliminate the scope for corruption.

Delivery: DBT, GST implementation, JAM trinity, e-auction systems helped in eliminating middlemen, bringing transparency in the system and plugging leakages of public money. #ModiHiAayega https://t.co/c3EkHcVyV9",265,609,['ModiHiAayega']
2019-04-12 11:33:00,1116665516519591936,"देशभर में सीमेंट के दाम घट रहे हैं, लेकिन छत्तीसगढ़ में सीमेंट के दाम बढ़ रहे हैं क्योंकि भूपेश बघेल टैक्स इस पर लग गया है: श्री अमित शाह #ModiHiAayega https://t.co/6iaIY2Q4o7",228,808,['ModiHiAayega']
2019-04-12 11:29:23,1116664604933754880,15 साल के अंदर देशभर के विकसित राज्यों की सूची में छत्तीसगढ़ को चौथे स्थान पर लाने का काम रमन सिंह जी ने किया था: श्री अमित शाह #ModiHiAayega,144,588,['ModiHiAayega']
2019-04-12 11:28:37,1116664413921001472,"एयर स्ट्राइक के बाद दो जगह मातम छाया था, एक पाकिस्तान में और दूसरा कांग्रेस पार्टी के कार्यालय में।

ये कांग्रेस पार्टी आतंकियों से ईलू-ईलू कर सकती है, हम नहीं कर सकते। 

हमारी नीति स्पष्ट है, वहां से गोली आएगी तो यहां से गोला दागा जाएगा: श्री अमित शाह #ModiHiAayega",713,2590,['ModiHiAayega']
2019-04-12 11:26:13,1116663807739224064,"छत्तीसगढ़ में कांग्रेस की सरकार आने के साथ ही यहां सीबीआई पर बैन लगा दिया।
यहां पहले रमन सिंह जी की सरकार थी, उनको कभी सीबीआई को रोकने की जरूरत नहीं पड़ी। क्योंकि उनका दामन साफ था। उनके शासन में कोई भ्रष्टाचार नहीं हुआ: श्री अमित शाह #ModiHiAayega",247,864,['ModiHiAayega']
2019-04-12 11:25:49,1116663710074851328,10 साल तक देश में सोनिया-मनमोहन की सरकार थी। 10 साल में 12 लाख करोड़ का भ्रष्टाचार उन्होंने किया और आज दावा करते हैं कि देश का विकास करेंगे। 55 साल तक उन्होंने देश का विकास नहीं किया और अब नारे दे रहे हैं: श्री अमित शाह #ModiHiAayega,193,622,['ModiHiAayega']
2019-04-12 11:24:31,1116663380155043840,मैं राहुल बाबा से कहना चाहता हूं कि केवल विकास के नारों से विकास नहीं होता। गरीबों के लिए मन में दर्द होता है तब जाकर विकास होता है: श्री अमित शाह #ModiHiAayega,294,1181,['ModiHiAayega']
2019-04-12 11:18:16,1116661808163540996,"मैं आज यहां से छत्तीसगढ़ के मुख्यमंत्री से कहना चाहता हूं कि अगर आपको कुछ छुपाना नहीं है, तो भीमा मंडावी जी की हत्या की सीबीआई जांच करवाइये। दूध का दूध और पानी का पानी हो जाएगा: श्री अमित शाह #ModiHiAayega https://t.co/cNnboicP9k",226,682,['ModiHiAayega']
2019-04-12 10:47:53,1116654163465650177,"प्रधानमंत्री श्री नरेन्द्र मोदी ने फिर बढ़ाया भारत का मान।  

अपने सर्वोच्च नागरिक सम्मान 'सेंट एंड्रयू द एपोस्टल' से प्रधानमंत्री श्री नरेन्द्र मोदी को सम्मानित करेगा रूस। https://t.co/3RUdXQ4qbt",1016,3045,[]
2019-04-12 10:40:00,1116652176971984896,"In the first phase of election, the wave of BJP and its allies will sweep the opposition. The situation in West Bengal is chaotic. It's a sign of an imminent change: PM Modi #ModiHiAayega",326,972,['ModiHiAayega']
2019-04-12 10:35:16,1116650986632704000,"जो सैनिक देश की सेवा के लिए जाते हैं, देश की रक्षा के लिए कुछ भी कर गुजरते है, 

रेगिस्तान में 50 डिग्री तापमान में जो जलते सुरज को झेलते हैं, 

महीनों तक समुद्र में तिरंगा लेकर दुश्मन को भटकने तक नहीं देते। 

उनके लिए ऐसी सोच...

देश की सेना का अपमान करने वालों, डूब मरो: पीएम https://t.co/MVi9qgDJEH",335,1057,[]
2019-04-12 10:32:26,1116650272787320834,"Karnataka govt hasn't sent list of eligible farmers for sending financial assistance. 

When Modi govt again forms govt, all farmers of Karnataka will receive financial assistance: PM Modi #ModiHiAayega",317,976,['ModiHiAayega']
2019-04-12 10:30:51,1116649875557380097,"For the festival of Sultan, they have money but fall short of money when it comes to celebrating Hampi festival: PM Modi #ModiHiAayega",272,844,['ModiHiAayega']
2019-04-12 10:28:00,1116649160671817729,"Karnataka CM told that people who can't arrange two square meals join the forces. 

He has insulted the soldiers of our armed forces. They secure our borders facing adverse conditions. However, these people can't understand this: PM Modi #ModiHiAayega",285,859,['ModiHiAayega']
2019-04-12 10:27:45,1116649095546806275,"""भाजपा असम की तरह बंगाल में भी एनआरसी लाने वाली है। एक-एक घुसपैठिये को चुन-चुन कर देश से बाहर भेज दिया जाएगा।

साथ ही बांग्लादेश से, पाकिस्तान से या कहीं से भी जो हिंदू, सिख, जैन, बौद्ध शरणार्थी आए हैं उन्हें वापस नहीं भेजा जाएगा और भारत की नागरिकता दी जाएगी।"" : श्री @AmitShah https://t.co/KYKr9jqKr1",1203,3240,[]
2019-04-12 10:25:57,1116648642130001920,"The money seized from Tughlak road scam was meant for nutritious food for the poor children &amp; pregnant women.

Congress has committed a grave sin by depriving innocent children and women of their right. They will not be pardoned for it: PM Modi #ModiHiAayega https://t.co/pQwKtKWpki",343,771,['ModiHiAayega']
2019-04-12 10:25:10,1116648444918022144,"कर्नाटक में परिवारवाद के प्रतीक हैं कांग्रेस और JDS। 

दोनों ही पार्टियां जनता से जितनी कटी हुई हैं, उतनी ही अपने परिवार से जुड़ी हुई।

इनके लिए आपकी आवश्यकताएं नहीं, देश की जरूरतें नहीं, बल्कि अपना स्वार्थ महत्वपूर्ण है।

कमीशन ही इनका मिशन है: : पीएम मोदी #ModiHiAayega",296,1025,['ModiHiAayega']
2019-04-12 10:19:13,1116646947048157184,"This is an election between Nation First or Family First. 

Congress and JDS are detached from people and attached to their own family: PM Modi #ModiHiAayega https://t.co/I2eWy2mU35",554,1771,['ModiHiAayega']
2019-04-12 10:17:36,1116646541295439872,"Deve Gowda's son has told that he would retire from politics if NDA again forms govt in the centre. 

Do you believe him?

During 2014 election, Deve Gowda ji had said that if Modi becomes PM, he would retire.

As expected, he didn't retire from politics: PM Modi #ModiHiAayega https://t.co/prtIsltND4",416,1164,['ModiHiAayega']
2019-04-12 10:15:28,1116646005271748608,"PM Modi addresses public meeting in Gangavathi, Karnataka. Dial 9345014501 to listen LIVE. #ModiHiAayega https://t.co/LwnG0URtko",388,1050,['ModiHiAayega']
2019-04-12 10:12:07,1116645161352617984,"आज आपकी भीड़ का ये दृश्य दिखाता है कि हवा का रुख किस तरफ है। 

देश में जहां-जहां मुझे जाने का मौका मिला है, वहां एक ही लहर दिख रही है, वो लहर है ‘फिर एक बार मोदी सरकार': पीएम मोदी #ModiHiAayega https://t.co/Fpfz36DGgF",247,776,['ModiHiAayega']
2019-04-12 09:25:20,1116633389279244288,"भ्रष्टाचारियों होशियार, 
भगोड़ों पर कानून की मार, 
बंद हुआ काला कारोबार, 
देशद्रोहियों पर कड़ा प्रहार, 
आतंक पर आखिरी वार, 
दुश्मन हो जा ख़बरदार, 
घुसपैठिए भागे सीमा पार, 
टूटेगी जात-पात की दीवार,
वंशवाद की होगी हार, 
दागदार पर भारी कामदार: पीएम श्री @narendramodi #ModiHiAayega https://t.co/LFdFh2mya7",752,2250,['ModiHiAayega']
2019-04-12 09:23:49,1116633006712610816,"मैं महाराष्ट्र और देश के 'फर्स्ट टाइम वोटर' से पूछना चाहूंगा कि क्या देश की सुरक्षा पर पहले की सरकारों का कमजोर रवैया उन्हें मंजूर है?

क्या राष्ट्रीय सुरक्षा से समझौता उन्हें मंजूर है?

क्या 21वीं सदी के भारत की पहचान कमजोर देश के तौर पर होनी चाहिए?: पीएम मोदी #ModiHiAayega https://t.co/SdvhsIkvYK",512,1364,['ModiHiAayega']
2019-04-12 09:21:36,1116632447016292355,"बीते 5 वर्ष में जनभागीदारी से चलने वाली एक मज़बूत और निर्णय लेने वाली सरकार, दुनिया ने भारत में देखी है।

अब आपको तय करना है कि ईमानदार चौकीदार चलेंगे या फिर भ्रष्टाचारी नामदार।

हिन्दुस्तान के हीरो चलेंगे या पाकिस्तान के पैरवीकार: प्रधानमंत्री श्री @narendramodi #ModiHiAayega https://t.co/mcStsDicVf",377,1068,['ModiHiAayega']
