Date,ID,Full Text,Retweet Count,Like Count,HashTags
2019-03-31 07:50:22,1112260836746117121,आज अमित शाह जी अपना नामांकन करने जा रहे हैं। मैं उन्हें अपनी शुभकामनाएं देने आया हूं। हमारे कद्दावर नेता लालकृष्ण आडवाणी जी के उत्तराधिकारी के रूप में इस संसदीय क्षेत्र से अमित भाई नामांकन कर रहे हैं। मैं आश्वस्त हूं कि यहां की जनता उन्हें भरपूर आशीर्वाद देगी: श्री राजनाथ सिंह https://t.co/ie9fwLKQWE,484,1402,[]
2019-03-31 07:20:35,1112253340367241216,"2014 की आशाएं अब एक विश्वास में बदल गई हैं कि NDA ही देश को नई ऊंचाई पर ले जा सकता है।

पहले जो नामुमकिन था वो अब मुमकिन है।  लोगों को लगने लगा है कि आतंकवाद को मुंहतोड़ जवाब दिया जा सकता है।

जो दशकों तक सत्ता में रहे, वो विपक्ष के रूप में भी पूर्णतः असफल रहे: पीएम मोदी https://t.co/z8K6E053jS",612,1763,[]
2019-03-31 07:16:18,1112252261831315457,"जिनकी नीयत देश के करदाताओं के पैसे पर डोल रही हो

जो सिर्फ अपनी नहीं बल्कि अपनी आने वाली पीढ़ियों के लिए भी इंतजाम करना चाहते हों 

वो ईमानदार व्यवस्था का निर्माण नहीं कर सकते: प्रधानमंत्री श्री नरेन्द्र मोदी https://t.co/62cReIbN5Z",1598,4886,[]
2019-03-31 07:02:45,1112248853225308162,"A-SAT परिक्षण की हमारी क्षमता कबसे थी, ये तमाम वैज्ञानिक बता चुके हैं। 

कमी थी तो राजनीतिक इच्छा शक्ति और निर्णय लेने वाले नेतृत्व की।

जो इसपर निर्णय ही नहीं ले पाए, आज वही इस परिक्षण पर सवाल उठा रहे हैं।

राष्ट्र के लिए बड़े और कड़े फैसलों को कल पर टालना आपराधिक लापरवाही है। https://t.co/fUQwPMnIG6",904,2388,[]
2019-03-31 06:51:51,1112246107898208256,"शिवसेना और भाजपा दोनों की विचारधारा एक है।

विपक्ष को देखें तो ये खुद तो मिल गए लेकिन इनके दिल नहीं मिले।

हमारी सोच, विचार और नेता एक हैं, लेकिन विपक्ष का नेता कौन हैं?

मैं दिल से अमित भाई को शुभकामनाएं देने यहां आया हूं। आप आगे चलो हम साथ हैं: श्री उद्धव ठाकरे https://t.co/e5YXZ1waZg",3788,16237,[]
2019-03-31 06:29:54,1112240586247929859,"अमित शाह जी एक इंसान नहीं बल्कि संस्थान हैं। इनका पूरा जीवन एक लाइट हाउस की तरह हैं। 

मोदी जी के बाद अगर सरकार बनाने का किसी को क्रेडिट जाता हैं, तो वो अमित भाई हैं। ये एक जमीन से जुड़े हुए नेता हैं: श्री प्रकाश सिंह बादल https://t.co/nfQwUgW7QL",642,2304,[]
2019-03-31 06:12:01,1112236085445189634,"पिछले 5 साल में दिन रात मेहनत कर के भाजपा को गांव-गांव और बूथ -बूथ पर खड़े करने का काम आदरणीय अमित शाह जी ने किया है। 

मैं सार्वजनिक तौर पर कहता आया हूं कि संगठन को चलाने की जो क्षमता अमित भाई में है, उतनी दुनिया में किसी अन्य के पास नहीं है: श्री रामविलास पासवान https://t.co/mYijXadwKB",1177,5034,[]
2019-03-31 05:51:02,1112230802639609856,"अब हमारी सरकार ने ही जनधन खातों, आधार और मोबाइल की ट्रिनिटी से ये सुनिश्चित किया है कि गरीबों के अधिकार कोई छीन न सके और उनके हक़ का पैसा सीधा उनके खातों में जमा हो: प्रधानमंत्री श्री नरेन्द्र मोदी",592,2057,[]
2019-03-31 05:46:03,1112229550648287232,"भारत ने IBC के तौर पर ऐसा कानून बनाया है जिसके बाद अब ये सुनिश्चित हुआ है कि अगर बैंक से कर्ज लिया है तो वो हर हाल में लौटना ही होगा।

IBC को बने अभी 2 साल भी नहीं हुए हैं, इतने कम समय में ही बैंकों के लगभग 300 करोड़ रुपये वापस आ चुके हैं: प्रधानमंत्री श्री नरेन्द्र मोदी https://t.co/1wxLSRpzbS",527,1438,[]
2019-03-31 05:41:36,1112228431305924609,"बीते 5 वर्षों में हमारी सरकार ने रिज़र्व बैंक और सरकारी एवं प्राइवेट बैंकों के साथ मिलकर देश को फ़ोन बैंकिंग घोटाले से उभारा है, अब कोई बैंकों का पैसा लेकर बैठ नहीं सकता: प्रधानमंत्री श्री नरेन्द्र मोदी",711,2379,[]
2019-03-31 05:40:14,1112228087352061952,"आप लोग ही हेडलान चलाया करते थे. ये घोटाला हुआ, इतने लाख करोड़ का नुकसान हुआ। वो जब सरकार में थे उनकी जिम्मेदारी नहीं थी कि सिस्टम में ऐसे बदलाव किए जाएं, उसे फुलप्रूफ किए जाए: प्रधानमंत्री श्री नरेन्द्र मोदी",569,1679,[]
2019-03-31 05:34:56,1112226752422535169,"जिसकी नीयत देश के करदाताओं के पैसे पर डोल रही हो और जो सिर्फ अपनी नहीं बल्कि अपनी आने वाली पीढ़ियों के लिए भी इंतजाम करना चाहता हो, वो ईमानदार व्यवस्था का निर्माण नहीं कर सकता: प्रधानमंत्री श्री नरेन्द्र मोदी https://t.co/3C2MmkbANR",463,1183,[]
2019-03-31 05:34:23,1112226612295008257,"कालेधन पर एसआईटी बनाने को पिछली सरकार तीन साल तक टालती रही, हमनें आते ही इसपर फैसला लिया: प्रधानमंत्री श्री नरेन्द्र मोदी",509,1603,[]
2019-03-31 05:31:02,1112225772024954880,"हमारी सरकार जिस सोच के साथ काम कर रही है, ये देश ने बीते 5 वर्षों में अनुभव किया है। 

भारत की ग्लोबल स्टैंडिग पहले कहां थी? और आज कहां है इसकी तुलना कर के देख लीजिए: प्रधानमंत्री श्री नरेन्द्र मोदी",521,1489,[]
2019-03-31 05:29:07,1112225289680019457,"आज जब हम आत्म रक्षा के लिए सीमा पार कर आतंकियों को उनके घर में घुसकर मारते हैं, तो पूरी दुनिया हमारे साथ खड़ी हो जाती है। 

क्या 5 वर्ष पहले ऐसा संभव था?: प्रधानमंत्री श्री नरेन्द्र मोदी https://t.co/k6p7OSLhZo",455,1172,[]
2019-03-31 05:27:43,1112224936058212353,"पहले दुनिया नियम बनती थी और भारत को उसका पालन करना पड़ता था। 

आज हमारा देश दुनिया के नियम बनाने में अहम भूमिका निभाने की ओर बढ़ रहा है: प्रधानमंत्री श्री नरेन्द्र मोदी",1409,5446,[]
2019-03-31 05:25:15,1112224314235871232,"देश का एक भी राज्य ऐसा नहीं है, जहां जाकर भारत सरकार ने अपना कोई महत्वपूर्ण कार्य शुरू न किये हो: प्रधानमंत्री श्री नरेन्द्र मोदी",870,3251,[]
2019-03-31 05:22:38,1112223657835716608,"अर्थ जगत के लिए कल से नया साल शुरू होने वाला है, उसके लिए सबको बधाई और शुभकामनाएं: प्रधानमंत्री श्री नरेन्द्र मोदी https://t.co/vAp0N3uxbC",447,1241,[]
2019-03-31 05:16:09,1112222022996619264,LIVE: PM Modi's address at TV9 Bharatvarsh Conclave https://t.co/9oiiqMvEfR,891,2212,[]
2019-03-31 03:30:00,1112195310388940801,"हर उस भारतीय में है 'एक चौकीदार' जिसे है देश की फ़िक्र।

पीएम मोदी आज शाम 5 बजे #MainBhiChowkidar कार्यक्रम के अंतर्गत नये भारत के चौकीदारों से संवाद करेंगे। लाइव देखें 

• https://t.co/vpP0MInUi4
• https://t.co/E31AljBPQD
• https://t.co/ZGlmolkXOL
• https://t.co/jtwD1z6SKE https://t.co/UkYue6fB07",585,1537,['MainBhiChowkidar']
2019-03-31 02:00:00,1112172662489575424,"Capture the colours of elections...

Watch the dance of democracy...

Say NaMo again with NaMo TV.

Tune in to get real time coverage of PM Modi's election campaign and a lot more fascinating content. https://t.co/FrJVnLD43m",1850,5632,[]
2019-03-30 17:40:35,1112046979398328320,प्रधानमंत्री श्री नरेन्द्र मोदी की रैलियों में उमड़ा जन सैलाब। #NorthEast4Modi https://t.co/azor4qViwS,1463,5631,['NorthEast4Modi']
2019-03-30 16:56:21,1112035849959407616,"पीएम श्री नरेन्द्र मोदी कल सुबह 10 बजे 'TV9 भारतवर्ष' के राष्ट्रीय सम्मेलन को संबोधित करेंगे। लाइव देखें 

• https://t.co/vpP0MI6iTu
• https://t.co/E31Aljkes3
• https://t.co/ZGlmolCyGj
• https://t.co/jtwD1yPhm4 https://t.co/FDI33wrmM6",578,1651,[]
2019-03-30 16:28:20,1112028799426650112,भाजपा राष्ट्रीय अध्यक्ष श्री अमित शाह कल उत्तर प्रदेश में विशाल जनसभाओं को सम्बोधित करेंगे। लाइव देखें https://t.co/vpP0MI6iTu पर। https://t.co/DNgWIyhg9v,393,1269,[]
2019-03-30 15:00:01,1112006571096182784,"जब तुम जीतों तो सत्य की जीत, अगर हारो तो EVM में गड़बड़। 

जान लो ये सवाल तुमने लोकतंत्र पर उठाया है और इस बार भी #JantaMaafNahiKaregi https://t.co/nNOKsjZH6R",1749,5569,['JantaMaafNahiKaregi']
2019-03-30 13:30:00,1111983918842957826,"आज गांधीनगर लोकसभा क्षेत्र से मैं भाजपा प्रत्याशी के रूप में नामांकन करने जा रहा हूं।

आज जब मैं यहां बोल रहा हूं, तो मुझे 1982 के वो दिन याद आ रहे हैं जब मैं एक बूथ का बूथ अध्यक्ष था। 

मेरे जीवन से अगर भाजपा को निकाल दो तो केवल शून्य बचता है: श्री अमित शाह https://t.co/2OwIvwzN1F",1342,5454,[]
2019-03-30 12:51:34,1111974244764639233,"चाय बगान में काम करने वाले साथियों के लिए ही,

पीएम श्रमयोगी मानधन योजना बनाई गयी है। 

इस योजना से जुड़े लोगों को 60 वर्ष की आयु के बाद,

हर महीने 3 हजार रुपये की नियमित पेंशन सुनिश्चित होगी।

असम के हित और असम की अस्मिता की रक्षा ये चौकीदार ही कर सकता है: पीएम #NorthEast4Modi https://t.co/mi3rHhgzby",593,1793,['NorthEast4Modi']
2019-03-30 12:45:10,1111972636035170305,"असम की महान संतान लासित बोरफूकन ने एक बात कही थी, 'देहोत कोइ मोमाइ डाँगर न होइ'।

यानी ‘कोई भी मामा देश से बड़ा नहीं होता’। 

लेकिन कांग्रेस के लिए हर वो मामा देश हित से बड़ा है जो उनके स्वार्थ में उनका साथ देता है।

चाहे वो मिशेल मामा हो या क्वात्रोची मामा: पीएम #NorthEast4Modi https://t.co/HRIUQt0s8H",833,2532,['NorthEast4Modi']
2019-03-30 11:22:14,1111951765270753280,"मैं ये दावा नहीं करता कि 5 साल में मैंने सारे काम पूरे कर लिए हैं। 

जब 70 साल वाले ये दावा नहीं कर सकते, तो मैं ये दावा कैसे कर सकता हूं।

देश को आगे ले जाने के लिए जो कसर अभी रह गई है, 

उसको पूरा करने के लिए मैं फिर एक बार आपका आशीर्वाद लेने आया हूं: पीएम मोदी #NorthEast4Modi https://t.co/g6OV2amYyp",4111,15056,['NorthEast4Modi']
2019-03-30 10:38:42,1111940808444268549,"मोदी सरकार में जन-जन को मिली बेहतर स्वास्थ्य सेवाएं।

'निक्षय पोषण योजना' के अंतर्गत टी.बी. के मरीजों को 500 रुपये महीने की सहायता। 
देश में टी.बी. से होने वाली मृत्यु की संख्या में 32% की गिरावट। https://t.co/DedPXI9iCX",485,1250,[]
2019-03-30 10:12:28,1111934209499652096,"मिशेल मामा, क्वात्रोची मामा, ऐसे अनेक मामा हैं, जिनके लिए इन्होंने देश तक को दांव पर लगा दिया।

11 अप्रैल के दिन आपके पास चौकीदार को मजबूत करके देश के दलालों और घुसपैठियों को कड़ा संदेश देने का अवसर है: प्रधानमंत्री श्री नरेन्द्र मोदी #NorthEast4Modi",949,3314,['NorthEast4Modi']
2019-03-30 10:11:46,1111934030528679937,"यहां की महान संतान लासित बोरफूकन ने एक बात कही थी। 

कि कोई भी मामा देश से बड़ा नहीं होता। 

लेकिन कांग्रेस के लिए हर वो मामा देश हित से बड़ा है, जो उनके स्वार्थ में उनका साथ देता है: प्रधानमंत्री श्री नरेन्द्र मोदी #NorthEast4Modi",481,1648,['NorthEast4Modi']
2019-03-30 10:09:45,1111933521893818370,गरीबों और किसानों के साथ साथ यहां गांवों में सड़कों का जाल बिछाया जा रहा है। ब्रह्मपुत्र पर पांच नए पुल बनाने की स्वीकृति हमारी सरकार ने दी है: प्रधानमंत्री श्री नरेन्द्र मोदी #NorthEast4Modi,373,1075,['NorthEast4Modi']
2019-03-30 10:09:23,1111933433679233024,"आज असम में गरीबों का 5 लाख रुपये का तक इलाज सुनिश्चित हुआ है। 

गरीबों को पक्के घर मिल रहे हैं, 

गरीब बहनों को गैस के कनेक्शन मिल रहे हैं 

और छोटे किसानों को हर साल 6 हजार रुपये मिल रहे हैं: प्रधानमंत्री श्री नरेन्द्र मोदी #NorthEast4Modi",433,1284,['NorthEast4Modi']
2019-03-30 10:08:54,1111933310731608066,"असम के हित और अस्मिता की रक्षा ये चौकीदार ही कर सकता है। 

ये चौकीदार ऐसा है जिसपर आपको विश्वास है लेकिन विपक्षियों में खौफ है: प्रधानमंत्री श्री नरेन्द्र मोदी #NorthEast4Modi",357,1080,['NorthEast4Modi']
2019-03-30 10:08:32,1111933216871481344,"चाय के बागानों में काम करने वालों के लिए भी हमारी सरकार द्वारा पूरी संवेदना के साथ कार्य किया जा रहा है। 

चाय बागान में काम करने वाले साथियों के लिए हमने पीएम श्रमयोगी मान धन योजना बनाई है : प्रधानमंत्री श्री नरेन्द्र मोदी #NorthEast4Modi",366,1183,['NorthEast4Modi']
2019-03-30 10:08:04,1111933100236247041,"लड़ाई चाहे घुसपैठियों और आतंकियों से हो या दलालों और भ्रष्टाचारियों से। आपका ये चौकीदार डटकर खड़ा है।

भारत को धोखा देने वालों और भारत को लूटने वालों के साथ क्या हो रहा ये आप आये दिन मीडिया में देख रहे हैं: प्रधानमंत्री श्री नरेन्द्र मोदी #NorthEast4Modi https://t.co/8ZBTrq4HRl",411,1056,['NorthEast4Modi']
2019-03-30 10:03:17,1111931896454242304,"असम और भारत का हित केवल वही लोग कर सकते हैं, जिनके दिल में असम और भारत बसता है: प्रधानमंत्री श्री नरेन्द्र मोदी #NorthEast4Modi",315,1068,['NorthEast4Modi']
2019-03-30 10:02:55,1111931802623442945,"ये लोग चौकीदार का विरोध करते करते, आज भारत का ही विरोध करने लगे हैं: प्रधानमंत्री श्री नरेन्द्र मोदी #NorthEast4Modi",333,1052,['NorthEast4Modi']
2019-03-30 10:02:36,1111931724798156800,"भारत अब बदल चुका है, पूरी दुनिया भारत के साथ खड़ी है, हमारे हर कदम की सराहना हो रही है। 

लेकिन हमारे घर में महामिलावट की जमात इस गौरवपूर्ण बातों में अपना सुर मिलाने को तैयार नहीं हैं: प्रधानमंत्री श्री नरेन्द्र मोदी #NorthEast4Modi https://t.co/KFHLW4uYzO",296,739,['NorthEast4Modi']
2019-03-30 10:00:46,1111931261864427520,"यहां के युवा अपने बुज़ुर्गों से पता करें कि कांग्रेस ने कैसे असम को हर बार ठगा है, धोखा दिया है, असम के लोगों के विश्वास को तोड़ा है।

क्या ये सच नहीं है कि अगर सरदार पटेल ना होते, श्रद्धेय गोपीनाथ बोरदोलोई ना होते, तो असम की वो पहचान नहीं होती, जो आज है: पीएम #NorthEast4Modi",415,1355,['NorthEast4Modi']
2019-03-30 09:59:08,1111930853704101889,"अगर महामिलावट करने वाले लोगों के अतीत और वर्तमान को देखें, तो आपको पता चल जायेगा कि अगर गलती से भी ये लोग दोबारा आ गए, तो ये असम को वापस मुसीबतों में झोंक देंगे: प्रधानमंत्री श्री नरेन्द्र मोदी #NorthEast4Modi",408,1365,['NorthEast4Modi']
2019-03-30 09:56:01,1111930068110987264,"आज एक तरफ दमदार चौकीदार है और दूसरी तरफ महामिलावट वाले परिवार हैं।

एक तरफ असम का, राष्ट्रहित का विचार है और दूसरी तरफ वोट के लिए किसी भी हद तक जाने वालों का इतिहास है: प्रधानमंत्री श्री नरेन्द्र मोदी #NorthEast4Modi https://t.co/tRXBAJJ0zb",337,914,['NorthEast4Modi']
2019-03-30 09:54:34,1111929704464805888,"मैं ये दावा नहीं कर सकता कि 5 साल में मैंने सारे काम पूरे कर लिए हैं। 

जब 70 साल वाले ये दावा नहीं कर सकते, तो मैं ये दावा कैसे कर सकता हूं।

जो कसर अभी रह गई है, उसको पूरा करने के लिए ही मैं फिर एक बार आपका आशीर्वाद लेने आया हूं: प्रधानमंत्री श्री नरेन्द्र मोदी #NorthEast4Modi",1532,5684,['NorthEast4Modi']
