Date,ID,Full Text,Retweet Count,Like Count,HashTags
2019-04-06 14:20:03,1114533229023744000,"पवित्र करतारपुर साहिब कॉरीडोर के साथ कांग्रेस ने क्या सियासत की ये भी आप भलीभांति जानते हैं।

अगर कांग्रेस चाहती तो करतारपुर साहिब भारत में ही रह सकता था।

लेकिन सिर्फ 3-4 किलोमीटर की ही दूरी से ही गुरु साहिब के पवित्र स्थान को इन्होंने दूर कर दिया: पीएम #IndiaWantsModiAgain",506,1498,['IndiaWantsModiAgain']
2019-04-06 14:18:13,1114532768543793152,"कांग्रेस और ये महामिलावटी अपने स्वार्थ के लिए जाति-धर्म का खेल खेलते हैं। 

कर्नाटक चुनाव में वोट के लिए इन्होंने लिंगायत समुदाय के साथ क्या किया ये कोई भूला नहीं है: पीएम मोदी #IndiaWantsModiAgain",332,1038,['IndiaWantsModiAgain']
2019-04-06 14:15:24,1114532058921979904,"कांग्रेस केवल अपने वोटबैंक के लिए ही काम करती है। 

लेकिन आपके चौकीदार की सरकार 'सबका साथ-सबका' विकास के मंत्र पर काम करती है: पीएम मोदी #IndiaWantsModiAgain",290,918,['IndiaWantsModiAgain']
2019-04-06 14:14:54,1114531931012517888,"कांग्रेस ने गरीबों को आरक्षण देने का वादा किया था, लेकिन फिर गजनी हो गये।

सामान्य वर्ग के गरीबों को 10 प्रतिशत आरक्षण भी चौकीदार ने किया, वो भी किसी के हक को छेड़े बिना: पीएम मोदी #IndiaWantsModiAgain",345,1045,['IndiaWantsModiAgain']
2019-04-06 14:14:27,1114531819834171392,"जब भी कांग्रेस संकट में आती है तो ये पार्टी झूठे वादों का पिटारा खोल देती है। 

लेकिन बाद में 'गजनी' बन जाती है: पीएम मोदी #IndiaWantsModiAgain https://t.co/JVL7GwIp8v",287,748,['IndiaWantsModiAgain']
2019-04-06 14:12:53,1114531425506615296,"कांग्रेस मध्यम वर्ग की विरोधी है।

कांग्रेस के ढकोसला पत्र में एक बार भी मध्यम वर्ग शब्द नहीं है। इसलिए कांग्रेस से सतर्क रहिए, चौकीदार की तरह चौकस रहिए: पीएम मोदी #IndiaWantsModiAgain",348,1163,['IndiaWantsModiAgain']
2019-04-06 14:12:09,1114531240328093698,"कांग्रेस ने साफ़ कर दिया है कि वो देश के मध्यम वर्ग को लालची और स्वार्थी मानते हैं। 

इसलिए वो मध्यम वर्ग पर टैक्स का बोझ डालने की बात कर रहे हैं: पीएम मोदी #IndiaWantsModiAgain",504,1667,['IndiaWantsModiAgain']
2019-04-06 14:11:39,1114531115845296128,"महाराष्ट्र में कांग्रेस इतनी कमजोर हो गई है कि यहां जितने इनके विधायक हैं, उससे ज्यादा तो गुट बन गए हैं और ये गुट आपस में लड़ रहे हैं।

यहां महाराष्ट्र में इन लोगों ने किस तरह एक 'आदर्श सोसाइटी' बनाने की कोशिश की थी। वो आप अच्छी तरह जानते हैं: पीएम मोदी #IndiaWantsModiAgain https://t.co/t5UtJUTzaP",278,666,['IndiaWantsModiAgain']
2019-04-06 14:09:20,1114530532119855105,"ये जो नई सीट नामदार ने खोजी है, वहां की क्या स्थिति है वो सोशल मीडिया पर पता चलता है। 

कांग्रेस का झंडा कहां है ये खोजना पड़ रहा है। 

ये हाल है कांग्रेस का: पीएम मोदी #IndiaWantsModiAgain https://t.co/L1QlV7nnAS",398,971,['IndiaWantsModiAgain']
2019-04-06 14:07:21,1114530034549551105,"कांग्रेस की हालत टाइटैनिक जहाज की तरह है, ये हर एक नये दिन के साथ डूबती ही जा रही है।

कांग्रस के साथ जो-जो इस जहाज में बैठा था, वो NCP की तरह या तो खुद भी डूब रहा है या उठ-उठ कर भाग रहा है: पीएम मोदी #IndiaWantsModiAgain https://t.co/sdR4bmBzzx",266,697,['IndiaWantsModiAgain']
2019-04-06 14:01:39,1114528599548125184,"विशेष तौर पर सेना से जुड़े, देश की सुरक्षा से जुड़े काम में मिलने वाली दलाली इनको खासी पसंद है।

जितना बड़ा सौदा, उतनी ज्यादा मलाई

जीप घोटाले से लेकर, बोफोर्स और हेलीकॉप्टर की दलाली तक, इन्होंने बहुत खूब झंडे गाड़े हैं: पीएम मोदी #IndiaWantsModiAgain https://t.co/9oVnapHkZr",299,735,['IndiaWantsModiAgain']
2019-04-06 13:59:16,1114527997124415488,आतंकवाद ही नहीं बल्कि देश में भ्रष्टाचार को बढ़ावा देने वाली और उसे पालने वाली कांग्रेस ही है: पीएम मोदी #IndiaWantsModiAgain,415,1583,['IndiaWantsModiAgain']
2019-04-06 13:56:18,1114527253541482496,"कांग्रेस और उसके साथी भारत में दो प्रधानमंत्री चाहते हैं एक दिल्ली में और दूसरा जम्मू कश्मीर में। 

कांग्रेस जम्मू कश्मीर से AFSPA का कानून हटाएगी ताकि आतंकियों के सामने हमारे जवान लाचार हो जाएं, वो झूठे केसों में फंस जाएं: पीएम मोदी #IndiaWantsModiAgain https://t.co/A0Jw503u1m",277,698,['IndiaWantsModiAgain']
2019-04-06 13:53:03,1114526435140456448,गुड़ी पड़वा के इस पवित्र दिन एक बार फिर महाराष्ट्र के सभी भाई बहनों को बधाई देता हूं और आभार व्यक्त करता हूं। आपके सहयोग से ही ये प्रधानसेवक नये भारत के निर्माण का बीड़ा उठा पाया है: पीएम मोदी #IndiaWantsModiAgain https://t.co/kYPvNyZmx6,260,765,['IndiaWantsModiAgain']
2019-04-06 13:48:26,1114525272324239361,"PM Modi addresses public meeting at Nanded, Maharashtra. Dial 9345014501 to listen LIVE. #IndiaWantsModiAgain https://t.co/UkCOfDufmF",476,1351,['IndiaWantsModiAgain']
2019-04-06 13:47:11,1114524959231995904,"Glimpses of BJP National President Shri @AmitShah's Jan Sampark Abhiyan in Sabarmati, Gujarat. Watch at https://t.co/TW2VGCztDv #IndiaWantsModiAgain https://t.co/ILtftLzznx",263,630,['IndiaWantsModiAgain']
2019-04-06 13:39:02,1114522908158599171,"कांग्रेस की नीयत में खोट है, इसलिए दलालों और बिचौलियों का एक पूरा संसार इन्होंने विकसित किया है।
 
इसीलिए हेलिकॉप्टर की खरीदारी में दलाली खाने से भी ये बाज़ नहीं आए।

नीयत में खोट है, इसलिए कांग्रेस का नामदार परिवार आज जमानत पर बाहर है: पीएम मोदी #IndiaWantsModiAgain https://t.co/dMZvpT2KvT",656,1729,['IndiaWantsModiAgain']
2019-04-06 13:37:00,1114522394591281155,"मैं अभी-अभी ओडिशा से आया हूं। वहां कांग्रेस के नेता दूसरे दलों में पलायन कर रहे हैं।

तेलंगाना में कांग्रेस के सभी नेता पलायन कर रहे हैं।

और तो और, नामदार ने अपनी जिस सीट को वसीयत का हिस्सा मान लिया था, वहां से भी पलायन करने की नौबत आ गई है: पीएम मोदी #IndiaWantsModiAgain https://t.co/QVIA7N5eo7",548,1700,['IndiaWantsModiAgain']
2019-04-06 13:35:23,1114521988767174657,"आपको चौकीदार की सरकार चाहिए या भ्रष्टाचारियों की बारात। 

आज देश में कांग्रेस के खिलाफ आक्रोश का एक मजबूत भाव देखने को मिल रहा है।

भाजपा के शासन में छत्तीसगढ़ से नक्सली और माओवादी हिंसा को खत्म करने का एक सफल प्रयास किया गया है: पीएम श्री नरेन्द्र मोदी #IndiaWantsModiAgain https://t.co/dXXfh03h1J",443,1251,['IndiaWantsModiAgain']
2019-04-06 13:30:02,1114520642907336705,"बीते 5 वर्षों में आपने देखा है कि मजबूत सरकार का क्या मतलब होता है।

जब सरकार मज़बूत होती है तो, आतंकी हमलों के बाद देश चुप नहीं बैठता, घर में घुस कर मारता है।

जब मजबूत सरकार होती है तो, सर्जिकल स्ट्राइक और एयर स्ट्राइक होती है: पीएम श्री नरेन्द्र मोदी #IndiaWantsModiAgain https://t.co/LCJgCAesIR",496,1408,['IndiaWantsModiAgain']
2019-04-06 12:58:13,1114512636886933504,"LIVE: Shri @AmitShah's Jan Sampark Abhiyan in Sabarmati, Gujarat. #IndiaWantsModiAgain https://t.co/SN24fI89CA",1179,2904,['IndiaWantsModiAgain']
2019-04-06 11:50:30,1114495595421376512,"आज तक ने प्रधानमंत्री श्री नरेन्द्र मोदी के भाषण पर दिखाई गलत खबर।

आखिर क्यों? https://t.co/U2KZlMFf7b",18193,38043,[]
2019-04-06 11:17:10,1114487203512512512,The Central Election Committee of the Bharatiya Janata Party has released the 18th list of 24 candidates for the ensuing General Elections to the Parliamentary Constituency of different States. https://t.co/5aUGeJhp1v https://t.co/CxJpgM4vvH,309,742,[]
2019-04-06 10:47:19,1114479693040762881,"लोकसभा चुनाव में दिया आपका हर एक वोट मुझे मजबूत करेगा। 

दिल्ली में भाजपा की सरकार बनाएगा। 

आप जब पोलिंग बूथ में कमल के निशान पर बटन दबाएंगे, तो आपका वोट सीधा-सीधा मोदी के खाते में जाएगा: पीएम मोदी #IndiaWantsModiAgain",569,1751,['IndiaWantsModiAgain']
2019-04-06 10:46:42,1114479539248222209,"हम भी डीबीट के पक्षधर हैं और कांग्रेस भी डीबीटी की पक्षधर है।

हमारे डीबीटी का मतलब है डायरेक्ट बेनिफिट ट्रांसफर।

उनके डीबीटी का मतबल है डायरेक्ट बिचौलिया ट्रांसफर: पीएम मोदी #IndiaWantsModiAgain",416,1336,['IndiaWantsModiAgain']
2019-04-06 10:45:04,1114479125148749825,"क्या छत्तीसगढ़ में सारे किसानों की कर्जमाफी हो गई? क्या नौजवानों से किया वादा पूरा कर दिया?

हर चुनाव में कांग्रेस ऐसे ही झूठे वादों का ढकोसला पत्र निकालकर लोगों को भ्रमित करने का प्रयास करती है।

यही दशकों से कांग्रेस की राजनीति का तरीका है: पीएम मोदी #IndiaWantsModiAgain",402,1034,['IndiaWantsModiAgain']
2019-04-06 10:43:51,1114478821741215745,"कांग्रेस की नीयत में खोट है, इसलिए दलालों और बिचौलियों का एक पूरा संसार इन्होंने विकसित किया है।
 
नीयत में खोट है, इसलिए हेलिकॉप्टर की खरीदारी में भी दलाली खाने से भी ये बाज़ नहीं आए: पीएम मोदी #IndiaWantsModiAgain https://t.co/wfQm1Bvogi",299,669,['IndiaWantsModiAgain']
2019-04-06 10:40:12,1114477901884182528,"नामदार ने जिस सीट को अपनी वसीयत मान लिया था, वहां से भी पलायन कर गये हैं। 

अभी तो चुनाव का रंग जमा ही है, और ये सीट छोड़कर भाग रहे हैं: पीएम मोदी #IndiaWantsModiAgain https://t.co/3tmEqSu9Nj",319,786,['IndiaWantsModiAgain']
2019-04-06 10:37:53,1114477318997549056,"जो हमारे जवान आज नक्सलियों से निपट रहे हैं, सीमा की रक्षा कर रहे हैं, उन सैनिकों को जो एक विशेष रक्षा कवच मिला है, 

कांग्रेस ने अपने ढकोसलापत्र में उसे हटाने का फैसला किया है: पीएम मोदी #IndiaWantsModiAgain",335,967,['IndiaWantsModiAgain']
2019-04-06 10:36:48,1114477048028848128,"भाजपा के शासन ने छत्तीसगढ़ से नक्सली और माओवादी हिंसा को दूर करने का एक सफल प्रयास किया है।  

हम छत्तीसगढ़ और देश के लाखों सपूतों को बंदूक और बम की बर्बादी से बाहर निकालने में जुटे हैं: पीएम मोदी #IndiaWantsModiAgain",320,1089,['IndiaWantsModiAgain']
2019-04-06 10:33:52,1114476309797675008,"आपको चौकीदार की सरकार चाहिए या भ्रष्टाचारियों की बारात चाहिए?

आज कांग्रेस के खिलाफ मजबूत आक्रोश दिख रहा है। इसका कारण उनकी नीति ही है: पीएम मोदी #IndiaWantsModiAgain",391,1261,['IndiaWantsModiAgain']
2019-04-06 10:32:47,1114476033711824896,"जब मजबूत सरकार होती है तो सर्जिकल स्ट्राइक और एयर स्ट्राइक भी होती है।
 
जब मजबूत सरकार होती है, तो दुनिया भी हमारी बात सुनती है। 

मजबूर सरकार में दुनिया हम पर ही रौब झाड़ती है: पीएम मोदी #IndiaWantsModiAgain https://t.co/6sU13pqSY1",286,736,['IndiaWantsModiAgain']
2019-04-06 10:31:12,1114475639048818689,"बीते 5 वर्षों में आपने देखा है कि मजबूत सरकार का मतलब क्या होता है। 

जब सरकार मजबूत होती है तो आतंकी हमलों के बाद देश चुप नहीं रहता है, घर में घुसकर मारता है: पीएम मोदी #IndiaWantsModiAgain https://t.co/FPnbGI54Ds",294,713,['IndiaWantsModiAgain']
2019-04-06 10:29:11,1114475130908864512,"कांग्रेस और उसके साथी चुनाव लड़ रहे हैं आतंकवादी, अलगाववादियों को खुली छूट देने के लिए।

हम चुनाव लड़ रहे हैं आतंकवादी और अलगाववादियों को सजा देने के लिए: पीएम मोदी #IndiaWantsModiAgain https://t.co/g9IJXRFOEH",272,570,['IndiaWantsModiAgain']
2019-04-06 10:28:24,1114474930609868802,"लोकसभा चुनाव के समय देश के सामने एक तस्वीर है। ये तस्वीर नीयत की है, नीति की है। 

कांग्रेस चुनाव लड़ रही है अपने दल को जिताने के लिए और हम चुनाव लड़ रहे हैं देश को जिताने के लिए: पीएम मोदी #IndiaWantsModiAgain",321,1048,['IndiaWantsModiAgain']
2019-04-06 10:27:16,1114474646034718720,"नए भारत के निर्माण के लिए आपका नया आदेश, नया आशीर्वाद लेने छत्तीसगढ़ के भाई बहनों के बीच आया हूं: पीएम मोदी #IndiaWantsModiAgain https://t.co/RJfqTLZgOQ",242,573,['IndiaWantsModiAgain']
2019-04-06 10:17:35,1114472208288473088,"LIVE: PM Modi addresses public meeting in Balod, Chhattisgarh. Dial 9345014501 to listen LIVE. #IndiaWantsModiAgain https://t.co/xYoDZhgWTe",774,1736,['IndiaWantsModiAgain']
2019-04-06 10:01:30,1114468163150798848,"Generation after generations, Congress only gave slogans for the eradication of poverty. People got poorer &amp; their ministers got richer.

The poor now say that the removal of Congress from the country will automatically lead to the eradication of poverty: PM #IndiaWantsModiAgain https://t.co/16UgzVOt3V",630,1469,['IndiaWantsModiAgain']
2019-04-06 09:59:02,1114467541366202368,"BJD is doing the same in Odisha as Congress has done in the country. Therefore, BJP has forced them to shut down shops of the middlemen. 

To make a 'mazboor'govt in the centre, they are looking for an opportunity to form a grand alliance: PM Modi #IndiaWantsModiAgain https://t.co/cLqF8XdSc3",547,1182,['IndiaWantsModiAgain']
2019-04-06 09:56:03,1114466790417948672,"Let me tell you about the conspiracy of congress. They have planned to implement policy that will lead to inflation. 

Congress leaders are now openly labelling the middle-class as selfish. They want to burden them with heavy taxes: PM Modi #IndiaWantsModiAgain https://t.co/JoB8fvgo4N",1038,1923,['IndiaWantsModiAgain']
2019-04-06 09:51:51,1114465732417413120,"रोजगार के तीन पहलू हैं। औपचारिक रोजगार, अनौपचारिक रोजगार और अनेक संकेतक रोजगार।

तीनों जगहों से ही पिछले पांच वर्षों में नए रोजगार सृजित हुए हैं: पीएम नरेन्द्र मोदी, हिंदुस्तान के साथ साक्षात्कार में

पूरा पढ़ें- https://t.co/66Xv840ZGC #IndiaWantsModiAgain https://t.co/1ymEpkqhLJ",418,936,['IndiaWantsModiAgain']
2019-04-06 08:57:42,1114452108072243200,"Glimpses of BJP National President Shri @AmitShah's 'Jan Sampark Abhiyan' in Ahmedabad, Gujarat. #IndiaWantsModiAgain https://t.co/oN6emG6FXY",619,1515,['IndiaWantsModiAgain']
2019-04-06 08:50:40,1114450336003977216,"चुनाव घोषित होने के बाद मैं भारत के लगभग 70-80% राज्यों में दौरा कर चुका हूं। मैंने प्रो-इनकमबेंसी वेव न कभी गुजरात के चुनाव में देखी है और न ही 2013-14 में देखी: पीएम नरेन्द्र मोदी, हिंदुस्तान के साथ साक्षात्कार में

पूरा पढ़ें- https://t.co/66Xv840ZGC #IndiaWantsModiAgain https://t.co/TvM8QqnJjc",454,1084,['IndiaWantsModiAgain']
2019-04-06 08:48:33,1114449805487394823,"भारत की विदेश नीति भारत के हित में होती है। भारत-चीन सीमा पर विवाद होने के बावजूद हमारा राजनीतिक संबंध है, एक-दूसरे का सम्मान है। हम मतभेदों को विवाद नहीं बनने देंगे: पीएम मोदी, हिंदुस्तान के साथ साक्षात्कार में

पूरा पढ़ें- https://t.co/66Xv840ZGC #IndiaWantsModiAgain https://t.co/IR3hLdp9A9",412,883,['IndiaWantsModiAgain']
2019-04-06 08:44:07,1114448688791805957,"विगत 4.5 वर्ष में काले धन के खिलाफ उठाए गए कदमों से 1,30,000 करोड़ रुपये उजागर हुए हैं, जिस पर टैक्स और जुर्माना लगाया गया है?: पीएम मोदी, हिंदुस्तान के साथ साक्षात्कार में

पूरा पढ़ें- https://t.co/66Xv840ZGC #IndiaWantsModiAgain https://t.co/IcAcbvtWOe",571,1419,['IndiaWantsModiAgain']
2019-04-06 08:41:12,1114447953207279621,"देश का मीडिया अगर निष्पक्ष है तो उसका दायित्व है कि राष्ट्रीय सुरक्षा के मुद्दे पर कांग्रेस से सवाल पूछे। कांग्रेस के नेता बिना कोई सबूत के बोलते हैं: पीएम मोदी, हिंदुस्तान के साथ साक्षात्कार में

पूरा पढ़ें- https://t.co/66Xv840ZGC #IndiaWantsModiAgain https://t.co/fSCd5Qqky0",577,1361,['IndiaWantsModiAgain']
2019-04-06 08:39:08,1114447434451521538,"दोस्ती के रास्ते पर भी मैं ही आगे बढ़ा था और दुश्मनी के रास्ते पर भी मेरी पूरी तैयारी है। ये विश्व मोदी की बात पर भरोसा करता है। पाकिस्तान को मैंने कटघरे में खड़ा कर दिया: पीएम मोदी, हिंदुस्तान के साथ साक्षात्कार में

पूरा पढ़ें- https://t.co/66Xv840ZGC #IndiaWantsModiAgain https://t.co/FUVllNJx2l",501,1171,['IndiaWantsModiAgain']
